postUrl,imgUrl,postContent,type,likeCount,commentCount,repostCount,postDate,action,author,authorUrl,profileUrl,timestamp,viewCount,postTimestamp,sharedPostUrl,videoUrl,approximateDate
https://www.linkedin.com/feed/update/urn:li:activity:7369697502196871169,,"In *very-early-stage* startups, I come across two types of founders. The marketing-focused, who treat the product as a marketing problem, and the product-focused, who see marketing as a product problem.

The instinct of marketing founders is to shout louder, and chase top-of-the-funnel rather than building a better user experience. I find it difficult to be impressed by them. (Having said that, I am super impressed by Roy from Cluely. And I am keenly watching them write a new playbook..)

But product founders see marketing as an extension of the product itself. They try to fix the leaks in the user journey before turning on the tap. 

As these founders are passionate about their product, they accumulate deep insights about their users. When they start sharing those insights on social media, people are naturally drawn to their vision.. and to their product.

This isn't manufactured hype... it's an honest expression. These founders understand their first goal isn't to make a sale but to earn a moment of someone's attention. They know the biggest hurdle isn't a user's money but their most scarce resource.. their time.

One way to truly earn that time is through a genuine transfer of enthusiasm. And from there, let the product onboarding take over... where the job is to deliver a series of ""aha"" moments and run an efficient product funnel. 

These founders do need to overcome their inhibitions and start sharing their thoughts, though.",Text,93,9,3,1mo,Amit Singh reposted this,Amit Singh,https://www.linkedin.com/in/amisingh,https://www.linkedin.com/in/amisingh/,2025-09-15T11:03:00.000Z,,2025-09-05T00:00:00.000Z,,,2025-09-15
https://www.linkedin.com/feed/update/urn:li:activity:7369689554208899072,,"In *very-early-stage* startups, I come across two types of founders. The marketing-focused, who treat the product as a marketing problem, and the product-focused, who see marketing as a product problem.

The instinct of marketing founders is to shout louder, and chase top-of-the-funnel rather than building a better user experience. I find it difficult to be impressed by them. (Having said that, I am super impressed by Roy from Cluely. And I am keenly watching them write a new playbook..)

But product founders see marketing as an extension of the product itself. They try to fix the leaks in the user journey before turning on the tap. 

As these founders are passionate about their product, they accumulate deep insights about their users. When they start sharing those insights on social media, people are naturally drawn to their vision.. and to their product.

This isn't manufactured hype... it's an honest expression. These founders understand their first goal isn't to make a sale but to earn a moment of someone's attention. They know the biggest hurdle isn't a user's money but their most scarce resource.. their time.

One way to truly earn that time is through a genuine transfer of enthusiasm. And from there, let the product onboarding take over... where the job is to deliver a series of ""aha"" moments and run an efficient product funnel. 

These founders do need to overcome their inhibitions and start sharing their thoughts, though.",Text,93,9,3,1mo,Post,Amit Singh,https://www.linkedin.com/in/amisingh,https://www.linkedin.com/in/amisingh/,2025-09-15T11:03:00.000Z,,2025-09-05T00:00:00.000Z,,,2025-09-15
https://www.linkedin.com/feed/update/urn:li:activity:7364291777576529920,,RMG ban exposes our biases and blindspots,Text,34,1,1,1mo,Post,Amit Singh,https://www.linkedin.com/in/amisingh,https://www.linkedin.com/in/amisingh/,2025-09-15T11:03:00.000Z,,2025-08-21T00:00:00.000Z,,,2025-09-15
https://www.linkedin.com/feed/update/urn:li:activity:7359090921822441474,,"The ‘creators turning into a business’ trend is hitting a wall.

As creators professionalise, they start resembling the same polished brands their audience was trying to escape.

The edge now is in staying scrappy, not scaling up.",Text,10,0,0,2mo,Post,Amit Singh,https://www.linkedin.com/in/amisingh,https://www.linkedin.com/in/amisingh/,2025-08-16T11:03:00.000Z,,2025-08-07T00:00:00.000Z,,,2025-08-16
https://www.linkedin.com/feed/update/urn:li:activity:7358809999457865749,https://media.licdn.com/dms/image/v2/D5622AQGaZjgE-s-2pg/feedshare-shrink_800/B56Zh..rQBG4Ag-/0/1754477022926?e=1763596800&v=beta&t=UMwBHgkgz9oKz3bcnikp1LhGkOQznFLEONoL2DCgkZY,"Small is beautiful for agents

LLMs made us believe one big model could do it all.. that felt like boiling the ocean. It worked for some cases, but not for all... especially not for agents.

Agents need fast, cheap, narrow intelligence.. not general reasoning every time. Most agent tasks are structured, repetitive, mechanical... parsing inputs, calling APIs, generating boilerplate. You don’t need a 175b model for that... but most agents still call one.

SLMs flip the architecture.. instead of hitting a central brain, you embed small, specialized models into the workflow.

One model per task. Cheap, fast, easy to align, better latency, better unit economics, and often better performance.

This is an interesting shift in design.. one that fits how agents actually work.",Image,29,2,0,2mo,Post,Amit Singh,https://www.linkedin.com/in/amisingh,https://www.linkedin.com/in/amisingh/,2025-08-16T11:03:00.000Z,,2025-08-06T00:00:00.000Z,,,2025-08-16
https://www.linkedin.com/feed/update/urn:li:activity:7358783218633859072,,"AI has thrown vanity metrics out of the window.

No one cares about DAUs if they don’t pay… or engagement if it doesn’t convert… or even retention if there’s no revenue.

Everyone is demanding monetisation.. if the value isn’t captured, then there is no value.

This exposes fluff.. this forces clarity.",Text,17,0,0,2mo,Post,Amit Singh,https://www.linkedin.com/in/amisingh,https://www.linkedin.com/in/amisingh/,2025-08-16T11:03:00.000Z,,2025-08-06T00:00:00.000Z,,,2025-08-16
https://www.linkedin.com/feed/update/urn:li:activity:7358762972925579265,,"Stablecoins are quietly shifting the crypto narrative.. from casino chips to settlement rails.. less meme coins, more money movement.

For years, bad actors dragged crypto down.. scams, rug pulls, pump-and-dump games.. that phase feels behind us. 

Meanwhile, the world still runs cross-border payments on Swift… which is a network that doesn’t even move money.. it just sends a message: Bank A tells Bank B, “i owe you.” 

The money moves later. through intermediaries.. with delays, fees, and downtime.

Blockchains don’t send messages… they move money. Stablecoins settle instantly, globally, on-chain.

The world is finally ready to witness what this tech can actually do.. and multiple unicorns will be built on its back.",Text,15,0,0,2mo,Post,Amit Singh,https://www.linkedin.com/in/amisingh,https://www.linkedin.com/in/amisingh/,2025-08-16T11:03:00.000Z,,2025-08-06T00:00:00.000Z,,,2025-08-16
https://www.linkedin.com/feed/update/urn:li:activity:7355945703866576896,,"AI is making it easier to write code, to build products. Just like the typewriter made it easier to write. But the hard part isn’t the writing. It’s having something to say. 

Same with products. Knowing what to build, who to build for, and how to sell.
That’s still the real game. AI hasn’t changed that. 

Except for those who are seeking the truth, chasing user insights. But those are a rare breed anyway. 

Join Misfits to learn from those who chase user insights, who do not fit the mould.",Text,34,3,0,2mo,Post,Amit Singh,https://www.linkedin.com/in/amisingh,https://www.linkedin.com/in/amisingh/,2025-08-16T11:03:00.000Z,,2025-07-29T00:00:00.000Z,,,2025-08-16
https://www.linkedin.com/feed/update/urn:li:activity:7355865927621492737,,"‘It’s not landing well, improve your storytelling’. This is not helpful advice to founders… because the word storytelling is misleading. It focuses on the craft when the real problem is lack of clarity.

Pitching is not about polished slides. Or smooth articulation. It is about answering a few questions well. 

What is your proposition? 
Why should you win?
What can you become?

Personally, I have struggled the most with ‘what is my proposition’. It is a simple question but is the most difficult to answer. Unless it is not, like for startups who are building Uber for India or Blinkit for meds. But if you are trying to do something tangential, this one is the hardest.

When we get stuck like this, it’s not a bad idea to remember Charlie Munger’s “Invert, always invert.” Some ambiguity gets addressed by answering ‘what we are not’.

But it all starts with recognising that poor storytelling is often rooted in lack of clarity about our proposition.",Text,48,5,0,2mo,Post,Amit Singh,https://www.linkedin.com/in/amisingh,https://www.linkedin.com/in/amisingh/,2025-08-16T11:03:00.000Z,,2025-07-29T00:00:00.000Z,,,2025-08-16
https://www.linkedin.com/feed/update/urn:li:activity:7354432269412917248,,"Will there be Cursor for QA? Or will Cursor for QA be Cursor itself?

AI unleashes way more code into the world. More lines written means more potential failure points. More lines means more surface area for bugs. 

Also, the volume increase isn't linear. Bug density per line often climbs when developers lean on AI. Because they understand less of what they ship.

Human-written code fails in familiar ways. Off by one errors. Null pointer exceptions. Memory leaks in predictable spots. 

AI bugs are different animals… they emerge from training data quirks or model hallucinations. It creates perfectly syntactic code that does something subtly wrong. Traditional QA tools scan for known anti patterns. 

This creates a market wedge for an AI native startup… legacy testing tools are not designed for probabilistic code generation. New tools focus on how AI fails and try to the ‘weird’ stuff that developers using Cursor struggle with. 

The amateur coder explosion complicates this.. non technical people building with AI may need different QA. Because they can't debug traditional errors… and thus need plain English explanations and automated fixes. Could this be its own market segment.

To put it all together, more ‘developers’ writing a lot more code, code that has more bugs, and probably different type of bugs. Seems like a setup for a massive opportunity for a Cursor for QA kind of product.

But.. what if the code generators just absorb the QA function? Amazon's Kiro is already trying to build testing into the generation process… if Cursor and others follow this path, would standalone QA tools become less relevant. 

But then will there will be any bugs in the future? Even perfect code generators can produce imperfect results when they interact with messy prompts and missing context. Maybe the bugs don't disappear, they just shift form. Maybe ‘developers’ will push boundaries when code becomes bug-free… and new bug types will emerge.. and the cat and mouse game will continue.

At the moment I'm leaning towards 'Cursor will own the QA problem' because non-bugs is their problem statement too. But there must be a founder somewhere who find a way... What's your take? Will there be Cursor for QA? Or will Cursor for QA be Cursor itself?",Text,25,5,0,2mo,Post,Amit Singh,https://www.linkedin.com/in/amisingh,https://www.linkedin.com/in/amisingh/,2025-08-16T11:03:00.000Z,,2025-07-25T00:00:00.000Z,,,2025-08-16
https://www.linkedin.com/feed/update/urn:li:activity:7354403305894109186,,"My two... 

What is common between Brooke Bond, Kissan, Pond’s, Lakmé, and evem Horlicks and Boost?

All these brands were acquired by Unilever / HUL. 

HUL knows more about acquisitions than startups that tried to play roll-up with undiifferentiated products and indifferent brands.

Remember, brands were an answer to the problem ""our product is not differentiated”… not that brands can't innovate… but DTC startups focus on marketing, not product.. so..?

Maybe Minimalist was inspired a bit by the clever anti-branding positioning of Brandless (just like Bombay Shaving Company was probably inspired by Dollar Shave Club).. 

But Minimalist could differentiate on quality and communicate that well. It should thrive in the hands of a group that understands the sales & distribution better than most.",Text,10,0,0,2mo,Post,Amit Singh,https://www.linkedin.com/in/amisingh,https://www.linkedin.com/in/amisingh/,2025-08-16T11:03:00.000Z,,2025-07-25T00:00:00.000Z,https://www.linkedin.com/feed/update/urn:li:activity:7353617792387964928/,,2025-08-16
https://www.linkedin.com/feed/update/urn:li:activity:7353000370098356225,,"No one has tried it
“If it’s such a good idea, why hasn’t anyone done it yet?”

Many have tried and failed
“If others couldn’t crack it. why will you?”

Big incumbents exist
“Won’t google just do it?”

A few are trying now
“This space is already crowded""

Somehow, early on every idea is either too early, too late, too hard, or too obvious. and still, founders build great companies.

Because all one needs to succeed is 'a lot of paying customers'. it's simple, but not easy.",Text,75,3,5,2mo,Amit Singh reposted this,Amit Singh,https://www.linkedin.com/in/amisingh,https://www.linkedin.com/in/amisingh/,2025-08-16T11:03:00.000Z,,2025-07-21T00:00:00.000Z,,,2025-08-16
https://www.linkedin.com/feed/update/urn:li:activity:7352964562842763264,,,Poll,1,1,0,2mo,Post,Amit Singh,https://www.linkedin.com/in/amisingh,https://www.linkedin.com/in/amisingh/,2025-08-16T11:03:00.000Z,,2025-07-21T00:00:00.000Z,,,2025-08-16
https://www.linkedin.com/feed/update/urn:li:activity:7352308827196698624,,"We may see a shift in the winning founder archetype.

The ones who chased a vision that once felt delulu... now look smart as AI made it real. the revenue that took them 10 years is now happening in months.

This isn’t a one-off. AI is making the crazy ideas work. suddenly the crazy ones look foresighted. and the sane ones feel... safe.

The future belongs to the crazy ones, the misfits, the rebels...",Text,34,1,2,2mo,Amit Singh reposted this,Amit Singh,https://www.linkedin.com/in/amisingh,https://www.linkedin.com/in/amisingh/,2025-08-16T11:03:00.000Z,,2025-07-19T00:00:00.000Z,,,2025-08-16
https://www.linkedin.com/feed/update/urn:li:activity:7352308762256330753,,"No one has tried it
“If it’s such a good idea, why hasn’t anyone done it yet?”

Many have tried and failed
“If others couldn’t crack it. why will you?”

Big incumbents exist
“Won’t google just do it?”

A few are trying now
“This space is already crowded""

Somehow, early on every idea is either too early, too late, too hard, or too obvious. and still, founders build great companies.

Because all one needs to succeed is 'a lot of paying customers'. it's simple, but not easy.",Text,75,3,5,2mo,Amit Singh reposted this,Amit Singh,https://www.linkedin.com/in/amisingh,https://www.linkedin.com/in/amisingh/,2025-08-16T11:03:00.000Z,,2025-07-19T00:00:00.000Z,,,2025-08-16
https://www.linkedin.com/feed/update/urn:li:activity:7351868354703392768,,"We may see a shift in the winning founder archetype.

The ones who chased a vision that once felt delulu... now look smart as AI made it real. the revenue that took them 10 years is now happening in months.

This isn’t a one-off. AI is making the crazy ideas work. suddenly the crazy ones look foresighted. and the sane ones feel... safe.

The future belongs to the crazy ones, the misfits, the rebels...",Text,34,1,2,2mo,Post,Amit Singh,https://www.linkedin.com/in/amisingh,https://www.linkedin.com/in/amisingh/,2025-08-16T11:03:00.000Z,,2025-07-18T00:00:00.000Z,,,2025-08-16
https://www.linkedin.com/feed/update/urn:li:activity:7351592489587265536,,"Will quick commerce work beyond metros?

Quick commerce is a single-run logistics model. No milk runs. No batch deliveries. No fat AOVs to cushion costs. Every order must carry its own weight. And that weight gets heavier as you leave the metros. Lower density. Longer distances. Smaller baskets. Less willingness to pay for speed.

The result? Non-metros have underperformed, as Sajith points out.
“In the Indus Valley Report we had expressed scepticism where quick commerce could be profitable beyond the top 5% of pincodes in India (which had both density and affluence). This seems to have been broadly on the ball.”
Sajith Pai, VC, Blume Ventures
Source: Twitter / X

And yet, Flipkart Minutes is doubling down.
“The next wave of growth in quick commerce will come from 'non-California customers' who are more value-centric. This is where the majority of India's retail market lies, and we see a mix of both premium and value-centric users coming into play.”
Kanchan Mishra, Head, Flipkart Minutes 
Source: Outlook Business

My uneducated view is this. The real question isn’t whether quick commerce should go beyond metros. It’s how. Maybe the answer isn’t 10-minute delivery in Tier 2. Maybe it’s two hours. Or six. Maybe the winning category isn’t ice cream. Maybe it’s fashion. Or electronics. The problem is not demand. Tier 2 has plenty. But it has a different rhythm. Different frictions. Availability. Product access. Someone has to decode that.

In 2012, when I was at Jabong, we were pushed to launch same-day delivery. I tried to agrue against it. It was expensive, our contribution margins were already hurting us. And I thought the customer didn’t care. But.. the relevant team launched same-day delivery in Gurgaon and next-day in Bangalore. And it worked. Customers loved it. They shifted. That’s when I learned: 

It's not about whether the customer wants it. It’s about whether the customer will switch if someone offers it. All else being equal. And that is not metro user behavior. That is human behavior.

Even the slowest quick commerce beats the fastest ecommerce.
Half of ecommerce orders come from tier 2. In these cities getting your order in 6 hours instead of 3 days is a massive upgrade. Quick commerce doesn’t need to match metro speed. It just needs to materially beat what exists. 

So maybe quick commerce in tier 2 will focus on different categories, and offer lesser SLAs. And Flipkart is not poorly placed to play that.",Text,27,3,0,2mo,Post,Amit Singh,https://www.linkedin.com/in/amisingh,https://www.linkedin.com/in/amisingh/,2025-08-16T11:03:00.000Z,,2025-07-17T00:00:00.000Z,,,2025-08-16
https://www.linkedin.com/feed/update/urn:li:activity:7351262137077350402,https://media.licdn.com/dms/image/v2/D5622AQH-eMzdr9iztQ/feedshare-shrink_800/B56ZgTQtptIAAk-/0/1752669806276?e=1763596800&v=beta&t=D5AmJbMjDlFMTcPy6nVq1I1xmErrnXOFwXRYrbqOYsI,"When Vishal & I decided to back Mohit he was doing immersive audio stories. Microdrama was not the part of the thesis. But what impressed us the most was Mohit's obsession with ""immersive"". That obsession is playing out in a different format of stories now.

Overthinking the business models in the early stage investing is often not very useful. Appreciating founders' understanding of their users, and their ability to build matters more.",Image,27,1,0,2mo,Post,Amit Singh,https://www.linkedin.com/in/amisingh,https://www.linkedin.com/in/amisingh/,2025-08-16T11:03:00.000Z,,2025-07-16T00:00:00.000Z,https://www.linkedin.com/feed/update/urn:li:activity:7351229991050760193/,,2025-08-16
https://www.linkedin.com/feed/update/urn:li:activity:7351246374274822146,,"No one has tried it
“If it’s such a good idea, why hasn’t anyone done it yet?”

Many have tried and failed
“If others couldn’t crack it. why will you?”

Big incumbents exist
“Won’t google just do it?”

A few are trying now
“This space is already crowded""

Somehow, early on every idea is either too early, too late, too hard, or too obvious. and still, founders build great companies.

Because all one needs to succeed is 'a lot of paying customers'. it's simple, but not easy.",Text,75,3,5,2mo,Post,Amit Singh,https://www.linkedin.com/in/amisingh,https://www.linkedin.com/in/amisingh/,2025-08-16T11:03:00.000Z,,2025-07-16T00:00:00.000Z,,,2025-08-16
https://www.linkedin.com/feed/update/urn:li:activity:7351148566410637312,,"This space is heating up nicely.

Waymo is doing 2 million miles a week. 

Tesla's Robotaxi launched in Austin. Offers 2x Waymo coverage.

Baidu to launch its driverless cars on Uber in Asia this year.

Travis Kalanick is trying to buy Pony AI. (speculation)",Text,13,2,0,2mo,Post,Amit Singh,https://www.linkedin.com/in/amisingh,https://www.linkedin.com/in/amisingh/,2025-08-16T11:03:00.000Z,,2025-07-16T00:00:00.000Z,,,2025-08-16
https://www.linkedin.com/feed/update/urn:li:activity:7350857428973867009,,"Narrative violation? 

OpenAI made us believe that closed-source ai is winning. but competitive open-source models are now emerging, especially from china.. (moonshot’s kimi k2 is a recent example). they may lag the frontier models by a few months, but they are genuinely open-source and freely available, and offer a credible alternative to the walled gardens. a bit early to say that open-source ai can become the default globally... but odds seem to be going up..",Text,19,3,0,2mo,Post,Amit Singh,https://www.linkedin.com/in/amisingh,https://www.linkedin.com/in/amisingh/,2025-08-16T11:03:00.000Z,,2025-07-15T00:00:00.000Z,,,2025-08-16
https://www.linkedin.com/feed/update/urn:li:activity:7350850787884814337,,"Seeing this interesting trend emerge: backdoor acquisitions 

As regulators in the usa tightened the screws on m&a, big tech found a workaround and rewrote the playbook to 'acquire' ai companies. 

As we know in ai the real asset is talent.. not ip, not revenue... so instead of buying the whole company, big tech is now 'acqui-hiring' the relevant teams. 

But interestingly, they don’t shut down the original company... not entirely.. they leave it partly functional. this is to sidestep regulatory heat and avoid the optics of a full-blown takeover.",Text,12,0,0,2mo,Post,Amit Singh,https://www.linkedin.com/in/amisingh,https://www.linkedin.com/in/amisingh/,2025-08-16T11:03:00.000Z,,2025-07-15T00:00:00.000Z,,,2025-08-16
https://www.linkedin.com/feed/update/urn:li:activity:7350723492390088706,https://media.licdn.com/dms/image/v2/D5622AQGz6OIdbky_5A/feedshare-shrink_800/B56ZgMED1LGUAk-/0/1752549048865?e=1763596800&v=beta&t=wwZFVJKJlO3VaAs-04UdJ5li_Px6G6fYim4-M6ZUWgI,"1B agents ≠ 1B people or jobs

Each agent would take a tiny slice of a task.. and do it repeatedly, tirelessly and endlessly...

The worry is that even if new opportunities emerge and create more jobs than we lose to agents.. the pace at which this change is happening will not give us time to upskill our white collared workforce..",Image,15,2,0,3mo,Post,Amit Singh,https://www.linkedin.com/in/amisingh,https://www.linkedin.com/in/amisingh/,2025-07-17T11:03:00.000Z,,2025-07-15T00:00:00.000Z,,,2025-07-17
https://www.linkedin.com/feed/update/urn:li:activity:7349794558999744512,,"They want to label ai content

Fine for now. but ai is on a steep curve.
human content isn’t.

When ai gets really good, those labels will become badges.

'Who wrote it"" isn't important. ""Is it good"" is.

And best of us are teaching LLMs ""what good looks like"". ai learns fast.",Text,12,0,0,3mo,Post,Amit Singh,https://www.linkedin.com/in/amisingh,https://www.linkedin.com/in/amisingh/,2025-07-17T11:03:00.000Z,,2025-07-12T00:00:00.000Z,,,2025-07-17
https://www.linkedin.com/feed/update/urn:li:activity:7344326923361112064,https://media.licdn.com/dms/image/v2/D5622AQHMIWDvfCD88g/feedshare-shrink_800/B56ZexKaa9GoAo-/0/1751023987620?e=1763596800&v=beta&t=8O03ti8mjcl35nAeS4KdSqU1ATdGJvJROFf61YNJGAs,"Sorry but most vc funds are just a wrapper on the capital that doesn't look good on our cap tables. ifkyk.

In Misfits i have raised only from founder angels. they are there when i need them. they are not there when i don't need them. problem with most VCs is that they are there when i don't need them. again iykyk. 

Jasnoor Gill posted this image ""in defense of spray & pray"" on the Misfits community group. 

This got me thinking.. to me spray & pray always felt like VC-speak to discredit angels who write small cheques. a way to imply small = shallow. 

But good angels don’t spray... they are deliberate. but they take more bets. not because they lack conviction, but because early-stage is uncertain.

I’ve seen a few angels with enviable portfolios who later launched funds.. their funds did well. but not as well as their angel picks. 

Personally, I like to back founders who i know can build if they are focused on a fertile space.

Founders and fertile space offer stronger early signals than metrics imo.",Image,19,1,0,3mo,Post,Amit Singh,https://www.linkedin.com/in/amisingh,https://www.linkedin.com/in/amisingh/,2025-07-17T11:03:00.000Z,,2025-06-27T00:00:00.000Z,,,2025-07-17
https://www.linkedin.com/feed/update/urn:li:activity:7344284610106638336,,"A startup is running out of capital.
The founder is struggling to raise.
Why? Their revenue is flat.
Why? Her sales head quit.
Why? She asked him to take a (temp) pay cut.
Why? They are running out of capital.

It’s a loop. And it’s messy. 
That’s what building in real time looks like.
But it’s also real. And relatable. And insightful.
Not like a case study from the 90s.
“GE’s two-decade transformation: Jack Welch’s leadership.”
Hindsight edits out the chaos, makes decisions look obvious.
But in real time, cause and effect blur.

We learn while the outcome is still unknown.
Join Misfits to watch the reality unfold.",Text,60,4,0,3mo,Post,Amit Singh,https://www.linkedin.com/in/amisingh,https://www.linkedin.com/in/amisingh/,2025-07-17T11:03:00.000Z,,2025-06-27T00:00:00.000Z,,,2025-07-17
