postUrl,imgUrl,postContent,type,likeCount,commentCount,repostCount,postDate,action,author,authorUrl,profileUrl,timestamp,viewCount,postTimestamp,videoUrl,approximateDate
https://www.linkedin.com/feed/update/urn:li:activity:7297481396170723329,,"Where do I start? 

If I could count the number of young poets and diary-writers who have asked me this question, I’ll run out of all creases on my fingers. 

I started quite early, perhaps when I stopped googling quotes for a Facebook status and began to write my own. I wrote love essays on my friends’ walls (not the ones fortifying their homes). 

I wrote rhymes, free-verse, sometimes nothing substantial and gave it the title of ‘abstract’. My first portfolio was made on Google docs a day after chastising my 12th board marksheet. 

I got paid for blogs, articles, FAQs, keyword-research. SEO? I took up a course and learnt what digital marketing was all about.

I took everything that came my way. Dignified work? Sure. Need help for your college essay? Sure. Your baby’s first birthday invitation card? The quickest yes. 

I would attend college, go back home for client work, record voiceovers over the weekend, and go 35 hours without sleep to shoot the films I had written with people just as curious as I was. 

I wrote erotic, I wrote philosophy, I wrote research papers, I wrote ads, I wrote emails to random strangers on the internet. 

I’ve lost count of the number of odd projects I’ve taken. Some worked, some I completely sucked at. 

But I know exactly why there was so much room for experimentation. This was the time when social media was nothing more than a weekly escape for me. I didn’t know how better or worse were people of my age doing. 

So I did what I had to. I started everywhere, I found myself somewhere. 

Where should you start? 

Wherever there’s less noise about how many figures you can earn in a month. Wherever they don’t have the secret sauce for lead-generation or whatever’s the new buzzword. 

And if money is the problem, take up a job and start behind-the-scenes. Start with trying to write what you love to read. Just start somewhere right. :) 

#writer",Text,160,40,1,7mo,Post,Shailya Jaggi,https://www.linkedin.com/in/shailya-jaggi,https://www.linkedin.com/in/shailya-jaggi/,2025-03-19T21:16:00.000Z,,2025-02-18T00:00:00.000Z,,2025-03-19
https://www.linkedin.com/feed/update/urn:li:activity:7296032340839997441,https://media.licdn.com/dms/image/v2/D5622AQGw9eHGX7y_IQ/feedshare-shrink_800/B56ZUC2ucmHQAo-/0/1739509662232?e=1763596800&v=beta&t=yKFrPm1Amjc0Po2MF4cn0WNmqgPS_a3dBuU3PV6GWUw,"We met 14 years ago. 

Perhaps on Facebook, or was it Orkut? I wasn’t looking for anything serious, forby I was too young for love. 

Little commitment, more exploration. We would flirt, hold hands, dream, dance..

At first, we only met on rainy days. Those particularly somber evenings when you have to read a pretty poem and recite it to your aching heart. 

And then we began to find each other on the joyous ones. Loneliness was a populated town, and we evaded it with our love. 

But something changed when we performed together on the school stage. I don’t remember seeing a single pair of hands that didn’t clap. 

The sparks, the romance, the alchemy. All too evident. 

Something told me that we were end-game. And I must have been audacious to show us the commitment I did. I have my love tattooed on my forearm for God’s sake! 

It has been 14 years now. We meet in agony, in glee, in laughter, in tears. We’re late for our date on Mondays, but Sundays are only for us. 

We’ve spent weeks and months without each other, and they’ve always felt like eons, but the spark never dwindles. 

We meet on high-chairs at a dimly lit bar, we meet at the beaches, we meet when nobody’s around and even more when everybody’s watching. 

I haven’t known a better love. 
Me and my words against the world, or maybe just in it. 


P.S I got this tattoo at 18 when I decided I’d be nothing but a writer (which meant I’d be a lot at once). The ink’s old, the design’s shabby, but it says “I write my own universe”. 

#writer",Image,286,47,0,8mo,Post,Shailya Jaggi,https://www.linkedin.com/in/shailya-jaggi,https://www.linkedin.com/in/shailya-jaggi/,2025-02-17T21:16:00.000Z,,2025-02-14T00:00:00.000Z,,2025-02-17
https://www.linkedin.com/feed/update/urn:li:activity:7294933630378725376,,"We killed art. We killed intellect. We killed innocence. 

We witnessed talent turn latent and applauded Ewtubers for their quick success. We gave medals to the tiktok dancers and trends to performers. 

We scrolled to the doomsday watching people school us on how to look prettier, how to get richer, how to become smarter. 

We liked, shared, subscribed to mediocrity. We witnessed frivolity and crassness and gave it the title of ‘cool’ and ‘authentic’ and ‘real’. Real problem. 

We defended the rebel kids for their unhinged vagaries until we hinged on their absurdity. We brought fame to their lives, insecurities to ours. 

We murdered poets, they’re all dead in the society. We put our kids on the internet at the cost of their naivety, all for an adult’s entertainment. 

We buried the written-word, we chopped squat our attention spans. We read more tips and tricks than books and biographies. 

We watched what they ate in a day, what they have in their bags. We ate up the most expensive chunk of our time, we bulked up our emotional baggage. 

We’ll curse them, we’ll curse ourselves. We’ll swear to read good, watch good, hear good. But the truth is, we’ll continue to scroll.

We’re all culprits. 
Guilty as (un)charged. 

#writer",Text,892,123,32,8mo,Post,Shailya Jaggi,https://www.linkedin.com/in/shailya-jaggi,https://www.linkedin.com/in/shailya-jaggi/,2025-02-17T21:16:00.000Z,,2025-02-11T00:00:00.000Z,,2025-02-17
https://www.linkedin.com/feed/update/urn:li:activity:7294581373154037760,,"“Shaadi kab karni hai?” 
A question that will grate on you as soon as you touch 25, even sooner if you’re a woman. 

Having spent a lot of time alone and losing people to the ultimate climax of life, my aspiration was to have a fuller family. The kind of family where weddings are never intimate, because you know over 150 relatives by their names. 

I wanted to have a home, a husband, a kid, another kid for my first, a living room that looks like a night-club on a Diwali evening. In the most quintessential fashion, I wanted a ‘settled life’. 

And why shouldn’t one have that aspiration? Independence and togetherness co-exist, freedom and tradition can work in conjunction. I want whatever’s in my stars, and connect the dots to make it a goddamn constellation. 

But do you know what a settled life really is? When two or five, the family is full at all times. When you’ve found a living-room big enough for your time of leisure. When you have the emotional bandwidth to love a being, and a healthy body to birth one. 

When you have the choice to have all or none of that. All or none, YOUR CHOICE. 

The best relationship I’ll ever have is with myself, and everything else will be a bigggg heftyyyy bonus. Is that bonus still my aspiration? Hell to the yes. It’s a choice I want to deliberately and ardently make. 

I want to have a home, a husband, a kid, another kid for my first, a living room that looks like a night club on a Diwali evening. But first, I want a settled life. 

I’m on it. 

#writer",Text,241,71,0,8mo,Post,Shailya Jaggi,https://www.linkedin.com/in/shailya-jaggi,https://www.linkedin.com/in/shailya-jaggi/,2025-02-17T21:16:00.000Z,,2025-02-10T00:00:00.000Z,,2025-02-17
https://www.linkedin.com/feed/update/urn:li:activity:7293899722455429121,https://media.licdn.com/dms/image/v2/D5622AQGgG3djJyh0eA/feedshare-shrink_800/B56ZTkjHJQHEAg-/0/1739001206217?e=1763596800&v=beta&t=4wrGxUF2NbN47wGidvZxVexLzXTI_arFXpwu4EPfkic,"Every time I’ve done something after a break, I’ve done it with utter shame. 

When I was in school, I’d see life on psychedelics after a sick leave. Every teacher’s wicked smile jeered at my absent note, and their black bindis, a subtle symbolism of my dark future. 

My classmates laughed louder, ridiculed me, they knew I was behind fifteen pages of notes. The school assembly theme was ‘discipline is destiny’, do they know I was missing for a week? 

College? A bigger disaster. I would forget the way to my canteen from my classroom. Was it left, or right, am I still a part of the possie I gained entry to? 

I’ve been missing for far too long to have best friends, or any friends at all. The girl who generously gave me her scrunchie on the first day just walked past. Four days out of sight, forever out of mind. Dumb, Shailya! 

If I don’t touch my laptop all weekend, I’ll play out a dialogue in my head word by word. The one between my existing client and their new writer. 

Should’ve just taken my laptop to the bar, should’ve picked the call in the third ring. Was I sick for the second time this month? She’s laden with viruses, more severely with that of incompetence. 

The qualms have steadied with age and experience, the shame has taken a backseat. But the nerves? Still there. Every single time. 

The only place that doesn’t make me nervous after a break is this one. You all. 

I could disappear for a week and still be welcomed with a “I missed you” from someone I’ve never met. I get love in the same numbers and magnitude. I am hugged with the same warmth, no questions asked. 

And for that, I’m grateful beyond words. I’ve broken every possible LinkedIn rule. That of consistency and engagement and visibility. 

But honesty? Never. 
And you’ve appreciated every bit of it selflessly.

#writer",Image,115,25,0,8mo,Post,Shailya Jaggi,https://www.linkedin.com/in/shailya-jaggi,https://www.linkedin.com/in/shailya-jaggi/,2025-02-17T21:16:00.000Z,,2025-02-08T00:00:00.000Z,,2025-02-17
https://www.linkedin.com/feed/update/urn:li:activity:7293611837047156736,,"I’ve seen a someone with 100k followers be known for nothing, 
And a someone with 20k followers be worshipped for every word. 

People see it when you’re selling a chamanchaap SaaS tool without telling your audience that it’s an ad. 

People see it when you’re plagiarising someone’s viral post and calling yourself a LinkedIn Branding agency owner. 

People see it when you pretend to love your work with all your heart and soul but every piece from you is just a well-written GPT prompt. 

People see it when you build your 7-figure business  by feeding unrealistic goals, dreams, and packages to young freelancers. 

You’re not fooling anyone but yourself. 
You’re not gaining traction, you’re compounding huge losses. 

#plagiarism #sponsorships #creators #influencers",Text,237,65,1,8mo,Post,Shailya Jaggi,https://www.linkedin.com/in/shailya-jaggi,https://www.linkedin.com/in/shailya-jaggi/,2025-02-17T21:16:00.000Z,,2025-02-07T00:00:00.000Z,,2025-02-17
https://www.linkedin.com/feed/update/urn:li:activity:7293175237217566721,https://media.licdn.com/dms/image/v2/D5622AQGWkAykKH2qXA/feedshare-shrink_800/B56ZTaQH3JHEAo-/0/1738828475433?e=1763596800&v=beta&t=Q6Uv7sp_9ihpuKjIbyqyrSnxvydsfL7GJ8FvHzGfYvA,"Gratitude is the choicest practice. 

I come back home from a lengthy work-trip and smile at my untouched medicine sack. Gratitude. 

My AC’s set at 25 in scorching summers, while the heater stays on for 3 hours in the nights of January. Gratitude. 

I enter a restaurant without checking my bank balance thrice and eat what was only aspirational for my 14-year-old self. Gratitude. 

I pull one piece of clothing out of my wardrobe and a fabric avalanche erupts on my fluffy chappals. Gratitude. 

I’ve seen mountains, beaches, beaches with the backdrop of mountains, the big five of a jungle. Gratitude. 

I miss at least one meal a day, by choice. Please read that again. I miss one meal a day, by choice. Gratitude. 

I write for the love of it, I write for people, I write for my joy, I write for a living. Gratitude. 

There’s always something left to achieve. There’s upwards and onwards and ahead and far. 

So I choose to look within, look around, look at now. Look at home. You look at home. :) 


#writer",Image,209,46,1,8mo,Post,Shailya Jaggi,https://www.linkedin.com/in/shailya-jaggi,https://www.linkedin.com/in/shailya-jaggi/,2025-02-17T21:16:00.000Z,,2025-02-06T00:00:00.000Z,,2025-02-17
https://www.linkedin.com/feed/update/urn:li:activity:7292831304973197312,https://media.licdn.com/dms/image/v2/D5622AQH2UZWo8iEWNg/feedshare-shrink_800/B56ZTVXZsAHEAg-/0/1738746474601?e=1763596800&v=beta&t=yEvyfOsRye34d7a4EAa0azozj80TrDOKAmUxNTG3-FY,"I always wanted a man like Raj. 

If not in the middle of a farm with a mandolin, then at my doorstep with flowers. Always ready to love, always ready to rescue me. 

You can’t blame me now, can you? I have deep daddy issues that I seldom talk about, and I’ve grown up watching movies where men always trudge the extra mile. 

And then I met a man who needed a little more love than I did. He wasn’t broken, just not familiar with the grandeur of romance. Always a little hesitant, always a little shy. We call it the ‘bare minimum’ at our own convenience. 

Totally capable of building me a garden of flowers, but just didn’t know when and how to. At first, I was mad. Why am I not being rescued? Why am I the more vehement lover? 

Those godforsaken romantic movies, I tell you. Hugh Grant and Richard Gare spoiled me. They fed me unrealistic dreams. 

I’m better informed now. I know love is not all fireworks, and relationships are never 50-50. Sometimes the man’s a 70, and sometimes the woman. 

We can love in our own capacity, and yet abundantly. So who am I to say that I am the more vehement lover, when someone’s diffident love is their 150%? 

And why should I wait until I find someone whose 100% is as loud, unabashed, and dramatic as mine? Why can I not love more the person I want to love? I’m strong, I’m independent, I have degree in romantic gestures. 

What if..I am the Raj? And why doesn’t he deserve a Raj like me? 

#writer",Image,199,72,1,8mo,Post,Shailya Jaggi,https://www.linkedin.com/in/shailya-jaggi,https://www.linkedin.com/in/shailya-jaggi/,2025-02-17T21:16:00.000Z,,2025-02-05T00:00:00.000Z,,2025-02-17
https://www.linkedin.com/feed/update/urn:li:activity:7292447717048365056,https://media.licdn.com/dms/image/v2/D5622AQGjd22dIzm9Mg/feedshare-shrink_800/B56ZTP6iCEGoAg-/0/1738655020827?e=1763596800&v=beta&t=bMIhMAtwi8ClhtCflvs0bSsUt1JOCz1w_2Yy8F3xeOs,"Comfort zone. 

Waking up on the fifth snooze, working from home for the 3rd week of the month, all cameras off on a zoom call. 

Doing the known, talking to the familiar. Sauce pans are heavier than paper bags, and we no longer sauté, we have it all sorted. 10 mins away, just blink it. 

We want our kind of coffee on our side of the bed, pillows fluffed, books half-read, diaries painted with griffonage. Maps should drop me off at the doorstep of a cafe. 

You know what’s the worst part about your comfort zone? It makes you too comfortable. No plot-twists, no fears, no hikes, nothing to conquer today. 

Last month, all I did was step out of my comfort zone. 

I worked for 12 hour a day for seven days a week. 
I booked a flight 6 hours before I was supposed to catch it. 
I cooked two meals of my day; always ordered the last. 
I read fiction, it was all vague and all consumed. 
I talked to unfamiliar faces, went to unknown places. 
I took up the projects I’m not a ninja-master at. 
I stepped away from social media, I became more social. 
I wrote on the hardest day of writing; you’re reading it now. 

No, I’m not saying that I’ll push myself out of my comfort zone every day. I want to live more, not barely. 

But man-o-man, the comfort zone! It needs to be shown its place every once in a while. 

#writer",Image,120,31,1,8mo,Post,Shailya Jaggi,https://www.linkedin.com/in/shailya-jaggi,https://www.linkedin.com/in/shailya-jaggi/,2025-02-17T21:16:00.000Z,,2025-02-04T00:00:00.000Z,,2025-02-17
https://www.linkedin.com/feed/update/urn:li:activity:7287746256515350529,https://media.licdn.com/dms/image/v2/D5622AQFalWYbUezvVA/feedshare-shrink_800/B56ZSNGiZjGoAg-/0/1737534106569?e=1763596800&v=beta&t=uDdF3pMp-tbVDyBcu9UNB5Yeo6NCeZnKoiU8cSeH788,"I think it all began when I was 12. 
I would wake up before my morning alarm. 
Take a shower, let half my tresses air-dry, and then came the straightening wand. 
Wet hair sandwiched between a ssssssound, which was always more bearable than my lousy curls.

By 14, I was a fully grown woman.
I bled more blood than my body could make, 
So my lips were always pale, grey, ashy. Nothing like a woman’s lips in poems. 
Slathered a nivea tinted lipbalm, a fortune above my pocket-money, but still more affordable than my weary appeal. 

At 17, the greater part of my closet was black.
I handpicked darkness, because it is meant to make your waist look small. Tiny. Petite. Worthy of an embrace. 
Starved myself a day before the famous girl’s birthday party, but still fuller in confidence than on days I ate well. 

At 20, I read more non-fiction than ever. 
I would keep my paradoxes and thrillers on the bottom shelf. Women are beautiful AND smart. 
Witty, well-learned, well-spoken, well-mannered. 
Watched the movies I didn’t like, but was still more entertained than I was with my own character. 

Now that I am 25, 
I color my hair every year in a different shade of brown, and fix them only on Saturdays. 
I go for morning walks straight out of bed. Bare lips, lousy waves, pimple patches from a night before. 
I wear pink, blue, orange, sssssilver, golden, parrot-green, all-coloured prints. 
I read stories, I live stories, I write stories. 

I write stories. 

#writer #personalbranding #linkedin",Image,158,27,0,8mo,Post,Shailya Jaggi,https://www.linkedin.com/in/shailya-jaggi,https://www.linkedin.com/in/shailya-jaggi/,2025-02-17T21:16:00.000Z,,2025-01-22T00:00:00.000Z,,2025-02-17
https://www.linkedin.com/feed/update/urn:li:activity:7283360157206462464,https://media.licdn.com/dms/image/v2/D5622AQG8QN58Q3jwWQ/feedshare-shrink_800/B56ZROxdFgHwAk-/0/1736488378176?e=1763596800&v=beta&t=b2nUUlGlMIdDKicf5K3Cwqo4afnMZRBlJpIOAzHfW2w,"Where do you look for inspiration? 

I’ve turned pages after pages until they turned yellow. I’ve met strong women, independent women, soft women, proud women, confident women. 

And then there’s this one. She’s Parveen. 

Parveen takes care of a sizeable family. Two daughters, one newly married. A son who likes his hoodies fresh. A husband who is the biological father to one, step to the others. 

We’ve lustily suggested a small vacation to her, but she’s always on duty. From one home to another, her scope of work is more agile than what my contracts read. 

If today she’s having trouble with her landlord, tomorrow she’ll aggressively calculate her son’s school fee. And mind you, before I met her, I thought my math was the most bizarre. 

I wouldn’t say she’s the only woman I’ve seen grappling with the hurlies and burlies of life. But I’ll tell you what fascinates me. 

Her smile. Her laughter. Her curiosity. Her intelligence. Her kindness. Her love. 

She could be having the worst day possible, but she’ll gracefully knock my door to ask me why my lunch’s still sitting in the kitchen unattended. She jumps at an opportunity to learn a little more about her humble cellphone. 

When people are late to pay her, she would barely ever raise her voice. But, she’ll pose a question that would strike your bone (if the heart has one). “Why would someone, living in a big house, not pay a timely fee so that I can run my small house?” 

Sunny or cloudy, work or leisure, misery or glee - this woman smiles. 

She’s not our house-help. She’s our house manager. And God knows what I’d do without her. I’d cry in a corner and won’t stop until an external force hits me with happiness. Newton’s first law of emotion. 

I don’t smile on all days. But looking at her, sometimes, just sometimes, I want to. 

#writer #personalbranding",Image,137,28,1,9mo,Post,Shailya Jaggi,https://www.linkedin.com/in/shailya-jaggi,https://www.linkedin.com/in/shailya-jaggi/,2025-01-18T21:16:00.000Z,,2025-01-10T00:00:00.000Z,,2025-01-18
https://www.linkedin.com/feed/update/urn:li:activity:7283006684959068162,https://media.licdn.com/dms/image/v2/D5622AQGSTEp_naH58w/feedshare-shrink_800/B56ZRJv9OCH0Ag-/0/1736404104567?e=1763596800&v=beta&t=fhYvcznAB_60VBZGxLiX7JxMRNqSoK3bsx1X2H34KYA,"Success. 

A middle-class man cracks his 4th interview wearing the same crispy beige shirt. His mother splurges on barfi. 

A house-wife turned home-baker fulfils her first order with a butterscotch cake. Aakash gets a cricket bat for his birthday. 

A 20 year old who became a woman at 16 leaves trauma out of her boardroom meetings. Papa is planning retirement at 50. 

A first-generation engineer lands a job at one of the big four. Bade bhaiya can afford Priya’s wedding, and perhaps even some jewels. 

Who decides if someone has truly made it in their lives? Not the ones on the outside. 

You, me, the honest writer, the sincere teacher, the loyal corporate lancer, the founder, the smaller than small agency owner. 

All success stories. 

#success #writer #personalbranding",Image,384,84,2,9mo,Post,Shailya Jaggi,https://www.linkedin.com/in/shailya-jaggi,https://www.linkedin.com/in/shailya-jaggi/,2025-01-18T21:16:00.000Z,,2025-01-09T00:00:00.000Z,,2025-01-18
https://www.linkedin.com/feed/update/urn:li:activity:7282273006788255745,https://media.licdn.com/dms/image/v2/D5622AQFOvjZVjcb04Q/feedshare-shrink_800/B56ZQ_Ur4iH0As-/0/1736229181595?e=1763596800&v=beta&t=2KpE7HMATqFIYFRYFHxuVfSimghNe7KyfkbnM4JGIxw,"We got featured at the Times Square Billboard by topmate.io 🥹❤️

I know, personal branding is a bit of a buzzword for many. But I am so proud of the brand I’ve built here. 

The brand is all of you. The people who read me, the people who have left over 200 birthday wishes in my inbox. 

You make it possible, you make it special. 

#topmate #timessquare #writer #personalbranding",Image,265,99,1,9mo,Post,Shailya Jaggi,https://www.linkedin.com/in/shailya-jaggi,https://www.linkedin.com/in/shailya-jaggi/,2025-01-18T21:16:00.000Z,,2025-01-07T00:00:00.000Z,,2025-01-18
https://www.linkedin.com/feed/update/urn:li:activity:7281169467571613696,https://media.licdn.com/dms/image/v2/D5622AQHjTtVleGdwQg/feedshare-shrink_800/B56ZQvpCG9GoAg-/0/1735966076922?e=1763596800&v=beta&t=GEwptFXyiH2fDllINZeCVwbcw0VRK6kfac1WdCh-feI,"I’m turning 25 tomorrow and (erratic drumrolls) listicles are par for the course with LinkedIn. 

Let’s do a solid 15 (peut être?)! 

1. An obsession with independence can be self-inflicted misery. Dependency in moderation is a beautiful thing. Make friends, find love, go home. Humans don’t thrive as lone creatures. 

2. Passionate people will make you pity yourselves. If you had to drop yours for survival, chase it for pleasure. It’s a privilege to make it your vocation, it’s stupidity to surrender altogether. 

3. Comparison is inevitable. But next time you want someone’s life, make a list of things they gave up to achieve it. If these items are your non-negotiables, kick jealousy out. 

4. Nobody’s looking. Nobody remembers your fumbled words and wrinkled shirts. Don’t drop your self-esteem for that flash of a second someone takes notice of you. 

5. My world-view at 25 is not going to be the same as that at 35. Don’t be stubborn with your learnings. Change of heart, mind, and opinions. All beautiful things. 

6. One should have enough money to take themselves out of an unpleasant relationship, and enough self-love to enjoy a bus-ride alone. 

7. If you’re not happy with what you do, you won’t be happy with how you look. It’s not the weighing scale or your nose that you hate. It’s the lack of movement and procrastination that you despise. 

8. You’re not wiser than the next person you meet. See what you can take from people than measure how better or worse you are. None beneath or above, all come with lessons. 

9. You can wear modest clothes, hide your selfies, reject designer bags, skip makeup, write poetry, quit drinking without making someone else look bad. Choices don’t compete. 

10. Love will always escape you if you’re desperately looking for it. The universe will smell your desire and do everything to make you love yourself first. You’d rather start there. 

11. Disagree but with logic, with poise, with calm. Never to prove yourself right but to shed light on facts and myths, just and unjust. You’re not fighting a fight with the whole world. 

12. Ambition is not always position, influence, or wealth. It could be noble, slow, more often hidden from a scrollable social media feed. Don’t underplay it.

13. The more lies you tell people on the internet, the more lies you start believing about yourself. Praises will be louder than that inner voice telling you to improve. It’s sweet self-destruction. 

14. Faking success is bad, but faking emotional intelligence is degeneration! Admit it when you realise you don’t know better, and ask for help. Seeming mature isn’t better than wetting pillows at night. 

15. Nothing, absolutely nothing tastes better than how healthy feels. It’s a lone battle for the sharp mind to fight with a feeble body. 

16. Just when you think you can do one more shot before the night ends, just don’t. Save your gut, remember your night, mind your step. Just don’t do that last shot. 

#writer",Image,488,121,1,9mo,Post,Shailya Jaggi,https://www.linkedin.com/in/shailya-jaggi,https://www.linkedin.com/in/shailya-jaggi/,2025-01-18T21:16:00.000Z,,2025-01-04T00:00:00.000Z,,2025-01-18
