postUrl,imgUrl,type,postContent,likeCount,commentCount,repostCount,postDate,action,author,authorUrl,profileUrl,timestamp,viewCount,postTimestamp,videoUrl,sharedPostUrl,sharedJobUrl,approximateDate
https://www.linkedin.com/feed/update/urn:li:activity:7383527774176669696,https://media.licdn.com/dms/image/v2/D5622AQGoAsrcb9tF-Q/feedshare-shrink_2048_1536/B56ZnePUR7JYAw-/0/1760370196935?e=1763596800&v=beta&t=55NfNYtpKIAY7CjRRFNGSJRV1tjf3KmUV6C_12_6FA4,Image,"With AI Agents running amok at the Global Fintech Festival in Mumbai last week, Rootflo's AI Middleware hit multiple sweet spots for Banks, NBFCs & Fintechs alike!

Our star was the AI Gold Audit Agent - built for Bharat from the ground up with the stalwarts in the gold loan business.

But why we really stood apart is that we understood the biggest concern that Banks, NBFCs & Fintechs have in highly regulated market - #dataSecurity, especially when it comes to AI model interactions.

Our AI Middleware was the answer most were looking for - with the ability to build simpler AI agents for contact centre automations to highly complex agents like our AI Gold Audit Agent (where we use 5 different proprietary SLMs & 2 LLMs in a single workflow). And all of this deployed in your own Virtual Private Clouds in a single click.

And to top it all off, we were honored to be one of the few booths that our Indian Prime Minister, Shri Narendra Modi visited! 
(couldn't get hold of images of the same yet, but the video is when he's just passing by our booth)",133,16,5,2d,Post,Nitin K Shaji,https://www.linkedin.com/in/nitin-shaji,https://www.linkedin.com/in/nitin-shaji/,2025-10-14T15:26:00.000Z,,2025-10-13T00:00:00.000Z,,,,2025-10-14
https://www.linkedin.com/feed/update/urn:li:activity:7380524660750409728,https://media.licdn.com/dms/image/v2/D5622AQHTzmd3TqDsrw/feedshare-shrink_800/B56ZmzkD_BG0Ag-/0/1759654201681?e=1763596800&v=beta&t=txyQRdlKqlEaFn7eLU7MXBifTgUML55YuN0jQTpRfnU,Image,"✨Excited to share that Rootflo been selected as one of the top 10 fintechs building #AI for #Bharat for the upcoming Global Fintech Fest. 

The Bharat AI Experience Zone is curated by National Payments Corporation Of India (NPCI) & NVIDIA, and it's a privilege to be sharing our impact alongside upcoming fintechs and heavyweights of the industry.

If you're at GFF on Oct 7th-9th, please do come visit us at our booth at the Jasmine Expo 1 on the 3rd floor of the Jio World Centre. 

#GFF2025

Ashik Rahman Vishnu Satis Shubhanga Prasad Chiranth Patil Sidd Gandhi Abhishant Pant Pankaj Singh Prasanna Krishnamoorthy Gokul Kunnel Subash Bose Shekar Nair Thiyagarajan Maruthavanan (Rajan) Fahad VM",123,8,6,1w,Post,Nitin K Shaji,https://www.linkedin.com/in/nitin-shaji,https://www.linkedin.com/in/nitin-shaji/,2025-10-09T15:26:00.000Z,,2025-10-05T00:00:00.000Z,,,,2025-10-09
https://www.linkedin.com/feed/update/urn:li:activity:7378699837829017601,https://media.licdn.com/dms/image/v2/D5605AQHnu88vV6UhvA/videocover-high/B56ZmWlK5LKEB8-/0/1759167959374?e=1761213600&v=beta&t=1acyCRl9lf6ZLXtyicsMp17RUiahN92pbXhHszpe-hY,Video (LinkedIn Source),"And now the floodgates are open. 
Excited to see how this market will evolve, and the gold rush it's going to create! ✨",5,0,0,2w,Post,Nitin K Shaji,https://www.linkedin.com/in/nitin-shaji,https://www.linkedin.com/in/nitin-shaji/,2025-10-01T15:26:00.000Z,,2025-09-30T00:00:00.000Z,blob:https://www.linkedin.com/d35d6ca8-9605-4fa0-bb00-805ccee5b330,https://www.linkedin.com/feed/update/urn:li:activity:7378485227490480128/,,2025-10-02
https://www.linkedin.com/feed/update/urn:li:activity:7378380604834369537,,Document,"I just booked my tickets to be at #CapitalConnect2025 and the #GlobalFintechFest in #Mumbai next month. This will be my 4th year in a row attending this festival of fintech! It made me reflect on how far we’ve come as an ecosystem. 

Back in 2016, at YES BANK, I had the privilege of working with Aseem Gandhi, Anup Purohit, Ritesh. Pai, Amit Shah and others to build what was possibly #India’s first #fintech accelerator. Around the same time, Abhishant Pant was propelling the #GovtofMaharashtra fintech program lead by Suniti Nanda and many more.

Fast forward to today, the progress is undeniable. But so is the opportunity — to move beyond payments, and to shape how credit, wealth, and insurance can truly impact lives, especially in the era of AI. Feels like we've just seen the first decade of digital entrepreneurship and capital flow into Fintech in India, and the next two are going to be wild!

👉 As we head into Mumbai, I’d love to hear your perspective:
 Which fintech white space do you believe remains most under-addressed today — payments, credit, wealth, or insurance?

Join us for this conversation (and more) at #CapitalConnect2025 on 6th October at MCA, BKC.

#Fintech #India #CapitalConnect2025 #GFF2025

Pankaj Singh Abhishant Pant Sagrika Shah Chiranth Patil Naveen Kukreja Rajat Monga Ashish Singhal Mayank Goyal, CFA Nikhil Shankar Dulhani Pratap Singh Vivek Belgavi Abhijit Singh Asif CH Aditya Tulsian Kriyang Karia Alankar Tripathi Nilesh Gokral",48,2,3,3w,Nitin K Shaji reposted this,Shubhanga Prasad,https://www.linkedin.com/in/shubhangaprasad,https://www.linkedin.com/in/nitin-shaji/,2025-09-24T15:26:00.000Z,,2025-09-29T00:00:00.000Z,,,,2025-09-25
https://www.linkedin.com/feed/update/urn:li:activity:7373616407013613569,https://media.licdn.com/dms/image/v2/D5622AQE4l2lFRd_h8A/feedshare-shrink_1280/B56ZlRZC3OJ8As-/0/1758007144380?e=1763596800&v=beta&t=UbcjrFJLXydzCwOmnyM_4IejbwThI2HpAvYQwvtGKsY,Image,"Why isn’t #GenAI delivering the ROI everyone expected? 😅 Here’s what I’m seeing on the ground (esp. for BFSI):

- Most companies are stuck at “horizontal copilots” (think: chatbots and surface-level automations). Cool demos, but… business impact? Meh.

- The action’s in agentic AI: actual agents that dive into deep, complex workflows and get real stuff done, not just answer questions.

- But it’s not about just plugging in Vertical AI to a data stream —it’s about reimagining the way work and decisions flow, with agents(human & AI) at the center.

- For BFSI, this shift is even more urgent. Complex processes, heavy compliance, non-stop risk and fraud management—only robust AI middleware can handle that at scale.

AI middleware will become your “operating system” for all these agents: secure, modular, governed, and agile enough for strict BFSI requirements.

Anyone else seeing this play out? Or stuck in the land of copilots? Let’s talk! 💬
#AI #GenAI #AgenticAI #BFSI #Middleware #Transformation",122,5,0,1mo,Post,Nitin K Shaji,https://www.linkedin.com/in/nitin-shaji,https://www.linkedin.com/in/nitin-shaji/,2025-09-16T15:26:00.000Z,,2025-09-16T00:00:00.000Z,,,,2025-09-16
https://www.linkedin.com/feed/update/urn:li:activity:7364250382467821570,https://media.licdn.com/dms/image/v2/D5622AQFDGPP51OeCFg/feedshare-shrink_800/B56ZjCUryNHAAg-/0/1755606861501?e=1763596800&v=beta&t=ABgH7--Vix8zSSXPb-RQ5CVVvmT5MvHQJgVm7OE0DoE,Image,"To all fintech founders out there: 
If you're early in your journey, this is a great opportunity to showcase your startup to a large panel of investors!

And for us Rootflo, last year's #GFF Demo Day was a great launchpad not just for our fundraising efforts but also to boost our customer outreach. 

Not to mention a great chance to meet the up & coming players in #fintech

Pankaj Singh Abhishant Pant Sagrika Shah Husain Rangoonwala Ashik Rahman Vishnu Satis",20,0,0,1mo,Post,Nitin K Shaji,https://www.linkedin.com/in/nitin-shaji,https://www.linkedin.com/in/nitin-shaji/,2025-09-16T15:26:00.000Z,,2025-08-21T00:00:00.000Z,,https://www.linkedin.com/feed/update/urn:li:activity:7363548893533360128/,,2025-09-16
https://www.linkedin.com/feed/update/urn:li:activity:7353072570276958208,,Text,"Here's an opportunity to directly work with Ashik Rahman and help Rootflo launch it's rocketship 🚀

If you love selling Enterprise SaaS and can already imagine how #GenAI is going to transform BFSI, this is the calling to join us on our mission!

#hiring #startup #enterprise #sales",33,2,2,2mo,Post,Nitin K Shaji,https://www.linkedin.com/in/nitin-shaji,https://www.linkedin.com/in/nitin-shaji/,2025-08-17T15:26:00.000Z,,2025-07-21T00:00:00.000Z,,,https://www.linkedin.com/jobs/view/4270264197/,2025-08-17
https://www.linkedin.com/feed/update/urn:li:activity:7346089868264972288,https://media.licdn.com/dms/image/v2/D5622AQGzhu6DC2QYzQ/feedshare-shrink_800/B56ZfKNzk4HoAg-/0/1751444307288?e=1763596800&v=beta&t=L0rKIlNon-OIupa_jzyC3Hpk-HFbPNKhIaCitrXYWG4,Image,"It's been hard to imagine that 6 months of 2025 is over already.

There's been so much happening around the world, and probably has consumed all of us in some way. 

But it's a good time to reflect and take a pause.

Here's my pause:
- Lots of people were suffering across the world, and it did take a toll on lot of us mentally
- We were all chasing some sort of stability when there was so much volatility around us
- And among all this chaos, we at Rootflo, made some massive strides that we're proud off but shared very less of. More on that later.

That said, wishing all of you another 6 months of health, stability & happiness!

PS: Here's a pic from our team's weekend getaway some weeks back, where we decided to take a pause.",213,4,4,3mo,Post,Nitin K Shaji,https://www.linkedin.com/in/nitin-shaji,https://www.linkedin.com/in/nitin-shaji/,2025-07-18T15:26:00.000Z,,2025-07-02T00:00:00.000Z,,,,2025-07-18
https://www.linkedin.com/feed/update/urn:li:activity:7343281839287033859,,Text,"We're looking for someone who loves digging into numbers and finding the stories they tell!

What you'll get:
🔹Front-row seat to AI innovation
🔹Direct impact on product decisions
🔹Fast-paced startup energy

If you're passionate about data and want to help shape the future of AI, let's talk!
Apply via the link below👇
#DataAnalyst #AIStartup #Hiring #StartupJobs",53,12,2,3mo,Post,Nitin K Shaji,https://www.linkedin.com/in/nitin-shaji,https://www.linkedin.com/in/nitin-shaji/,2025-07-18T15:26:00.000Z,,2025-06-24T00:00:00.000Z,,,https://www.linkedin.com/jobs/view/4255548539/,2025-07-18
https://www.linkedin.com/feed/update/urn:li:activity:7328009996523229184,,Text,"Well, this news is grounding, for the right reasons!
Klarna reverts back to human-touch after attempting to entirely automate their contact centers, due to quality issues.

But I'm sure there's been a lot of gains made in that progress, not just for Klarna, but for everyone watching from the outside.
For one, Klarna has probably automated more than 80% of their customer queries, and tested the limits of what's possible with the existing suite of SOTA models. This will still mean a lot of cost savings for them, and is still the right path to take in 2025.

That said, it does open the doors for the actual issues that we've been recommending to our customers from day one. Here's a couple of obvious ones:

1. Humans aren't as comfortable talking to bots as they are to humans. Just like customers escalate issues from call center executives to managers when they get frustrated, they will continue to escalate things from AI agents to human agents. And this shortcut will get engrained into our muscle memory soon enough.

2. The best case scenario is that 80-90% of customer queries be automated through AI agents assuming they are mostly redundant queries. That said, this requires building a large centralized intelligence engine that gives AI models really good context of the entire business, previous issues faced by customers, and who the customer is to be really efficient. In my research, I haven't seen a company build it with the depth.


Link to the article in the comments.",36,5,0,5mo,Post,Nitin K Shaji,https://www.linkedin.com/in/nitin-shaji,https://www.linkedin.com/in/nitin-shaji/,2025-05-19T15:26:00.000Z,,2025-05-13T00:00:00.000Z,,,,2025-05-19
https://www.linkedin.com/feed/update/urn:li:activity:7316356748515151873,https://media.licdn.com/dms/image/v2/D4E22AQExdvHjx6b8Kw/feedshare-shrink_800/B4EZYixgVUHUAg-/0/1744340127136?e=1763596800&v=beta&t=QWsnlN4DujU0DJtSdDnrGMz1ONtTfuNZV95Amc_HjPc,Image,"Had the privilege of seeing this in action.

Game-changer. Period.

Good luck with the launch Raghu Reddy , sudeep sahu !",20,2,1,6mo,Post,Nitin K Shaji,https://www.linkedin.com/in/nitin-shaji,https://www.linkedin.com/in/nitin-shaji/,2025-04-19T15:26:00.000Z,,2025-04-11T00:00:00.000Z,,https://www.linkedin.com/feed/update/urn:li:activity:7316292784053706752/,,2025-04-19
https://www.linkedin.com/feed/update/urn:li:activity:7311040836303998976,https://media.licdn.com/dms/image/v2/D5622AQHUBmMIJqnEtQ/feedshare-shrink_800/B56ZXYI4eBGsAk-/0/1743087965583?e=1763596800&v=beta&t=c0tisRzP10WIpp8CQc8RRpdi9YnIJNrRFhLa1RFz0Qc,Image,"The latest #ChatGPT 4o Image Generator is going to put some #imageGen companies in serious risk if they're not entrenched in deep workflows with their customers.

Most users paying for image generation tools will also have a high overlap with ChatGPT plus subscriptions. And like the #superApps of old, we're heading into a phase where leaders like OpenAI, Anthropic and others will be building general purpose #superAI across most image, text, audio, video use cases.

PS: A pic from a movie outing with some folks from our Rootflo squad
Ashik Rahman Ananthu S Ajayan Vishnu R Kumar Sanosh Jacob",60,0,0,6mo,Post,Nitin K Shaji,https://www.linkedin.com/in/nitin-shaji,https://www.linkedin.com/in/nitin-shaji/,2025-04-19T15:26:00.000Z,,2025-03-27T00:00:00.000Z,,,,2025-04-19
https://www.linkedin.com/feed/update/urn:li:activity:7310221366228590592,,Article,"Agentic AI is often overused & misused these days, and for good reason - the potential is massive! Such opportunities do bring a lot of eyes, experiments and fancy demos too...
But the true value unlocks when we're able to replace entire workflows. And this is only possible with Agentic AI, especially at enterprise scale & accuracy.

Had a nice chat with Swathi Moorthy from ETtech on how we see Agentic AI changing the financial landscape in the country.

Head to the article to read more!",22,0,0,6mo,Post,Nitin K Shaji,https://www.linkedin.com/in/nitin-shaji,https://www.linkedin.com/in/nitin-shaji/,2025-04-19T15:26:00.000Z,,2025-03-25T00:00:00.000Z,,https://economictimes.indiatimes.com//tech/artificial-intelligence/decoding-agentic-ai-gold-rush/articleshow/119435472.cms,,2025-04-19
https://www.linkedin.com/feed/update/urn:li:activity:7309898370507059200,https://media.licdn.com/dms/image/v2/D4D22AQGO3RlWCq-hwA/feedshare-shrink_800/B4DZXH0L0HHAAg-/0/1742814101440?e=1763596800&v=beta&t=GzGqopp0prlXREaxg4ACB_YXCLZQsZROyCAq8m2bb6s,Image,"Fellow Fintech founders in #NY, DM me if you're there in NY in the coming week and want an intro to Shubhanga Prasad or Abhishant Pant",8,0,0,6mo,Post,Nitin K Shaji,https://www.linkedin.com/in/nitin-shaji,https://www.linkedin.com/in/nitin-shaji/,2025-04-19T15:26:00.000Z,,2025-03-24T00:00:00.000Z,,https://www.linkedin.com/feed/update/urn:li:activity:7309892163268501506/,,2025-04-19
https://www.linkedin.com/feed/update/urn:li:activity:7305539199007395840,,Text,"Should I do prompt engineering vs RAG vs fine-tuning ? I often see this question asked a lot. Here is my opinion on this:

1️⃣ If prompt engineering works for your use case, stick with it. No need for RAG or fine-tuning if simple prompting gets the job done.

2️⃣ If prompt engineering isn’t enough but RAG solves the problem, go with RAG. It’s often more efficient than fine-tuning, especially when working with evolving knowledge bases.

3️⃣ If both prompt engineering and RAG fall short, consider adapter-based fine-tuning (e.g., LoRA). This allows targeted improvements without the heavy cost of full fine-tuning.

4️⃣ If even adapter fine-tuning isn’t enough, then full fine-tuning might be necessary. But be cautious—challenges like catastrophic forgetting can arise.

5️⃣ There’s one more reason to consider fine-tuning/distillation: If you have a very specific use case (e.g., structured data parsing, simple summarization) and want to deploy a smaller, cheaper model (e.g., LLaMA 3.1 8B, DeepSeek R1 7B) that can perform just as well but at a fraction of the cost.

Choosing the right approach depends on trade-offs between accuracy, cost, and complexity. What’s your go-to strategy?
#AI #LLMs #FineTuning #RAG #PromptEngineering",26,3,1,7mo,Nitin K Shaji reposted this,Vishnu Satis,https://www.linkedin.com/in/vishnusatis,https://www.linkedin.com/in/nitin-shaji/,2025-03-20T15:26:00.000Z,,2025-03-12T00:00:00.000Z,,,,2025-03-20
https://www.linkedin.com/feed/update/urn:li:activity:7298955117330870272,https://media.licdn.com/dms/image/v2/D5622AQHQ7bM13QA5Pw/feedshare-shrink_800/B56ZUnDa4oGoAg-/0/1740116965205?e=1763596800&v=beta&t=xR9DV5--6YdmaMZ6J2QeGgm6Wda6h6BJiOl3AZbBdPQ,Image,"Our first OS product - #floAI, which is our take on an enterprise-friendly #AgenticAI framework, has been silently making strides towards making building enterprise AI applications far more simpler. 

Pretty sure this will come in handy to many folks building in the space.

Do check it out and let us know what you think - https://lnkd.in/gP2Nx3Mw",25,2,2,7mo,Post,Nitin K Shaji,https://www.linkedin.com/in/nitin-shaji,https://www.linkedin.com/in/nitin-shaji/,2025-03-20T15:26:00.000Z,,2025-02-22T00:00:00.000Z,,https://www.linkedin.com/feed/update/urn:li:activity:7298579553772281856/,,2025-03-20
https://www.linkedin.com/feed/update/urn:li:activity:7290254513578393601,https://media.licdn.com/dms/image/v2/D5622AQH8Qfk2Pw_HnQ/feedshare-shrink_800/B56ZSwv2EDGUAk-/0/1738132121222?e=1763596800&v=beta&t=FYLgk7CO1BqHZpRodkbqsw8gCBmk2dRli7ZBWzxsg-I,Image,"With all the news around how #DeepseekR1 is leading the way for a far more cost effective method to build models, this feels like a recurring theme.

- Brands like Xiaomi & Huawei disrupted the smartphone market with low-cost, high quality products.
- EV makers like BYD, NIO and even the Xiaomi supercar seems to be doing exactly the same!
 
So I'm guessing everyone expected this to happen especially given Deepseek's previous releases. 
But I guess one could never be prepared well enough for anything AI anymore :)",39,2,0,8mo,Post,Nitin K Shaji,https://www.linkedin.com/in/nitin-shaji,https://www.linkedin.com/in/nitin-shaji/,2025-02-18T15:26:00.000Z,,2025-01-29T00:00:00.000Z,,,,2025-02-18
https://www.linkedin.com/feed/update/urn:li:activity:7290073798010093568,https://media.licdn.com/dms/image/v2/D4D22AQEOTREPmlnlSw/feedshare-shrink_800/B4DZSrm56LHAAg-/0/1738045891047?e=1763596800&v=beta&t=dylaAofKehaHirpMx5qPAeFYR304dV-y1k_Xus1qTO0,Image,🤝,33,1,1,8mo,Post,Nitin K Shaji,https://www.linkedin.com/in/nitin-shaji,https://www.linkedin.com/in/nitin-shaji/,2025-02-18T15:26:00.000Z,,2025-01-29T00:00:00.000Z,,https://www.linkedin.com/feed/update/urn:li:activity:7289892836647325699/,,2025-02-18
https://www.linkedin.com/feed/update/urn:li:activity:7289633429921443841,https://media.licdn.com/dms/image/v2/D4D22AQEkyVFTfB_2TA/feedshare-shrink_800/B4DZSnpnpxHUAs-/0/1737979495201?e=1763596800&v=beta&t=v22aY202CJIUr4vTxqAUT8GSDJEGWPuGIZwPVs2t6r0,Image,"We could feel the excitement around #AgenticAI in BFSI, and how industry veterans are thinking about it. 

Not to mention that our chakna counter was a hit at the mixer 🍻

Thanks to The Fintech Yatra folks for making this happen!
Abhishant Pant Pankaj Singh Shubhanga Prasad Husain Rangoonwala Sagrika Shah",43,0,0,8mo,Post,Nitin K Shaji,https://www.linkedin.com/in/nitin-shaji,https://www.linkedin.com/in/nitin-shaji/,2025-02-18T15:26:00.000Z,,2025-01-27T00:00:00.000Z,,https://www.linkedin.com/feed/update/urn:li:activity:7289614356764323842/,,2025-02-18
https://www.linkedin.com/feed/update/urn:li:activity:7287814010488373248,https://media.licdn.com/dms/image/v2/D5622AQFrR-8A_JlwJQ/feedshare-shrink_800/B56ZSOEOSUHwAg-/0/1737550260256?e=1763596800&v=beta&t=Dc2H82YnOnWA_gFBoRfCI0DbTQmaWBZPwD9BPxXFwDE,Image,"Will be attending this year's Mumbai #FintechMeetup on the 23rd of Jan.

And this time, Rootflo is one of the #MixerPartners 🥂 too!

Join us for a powerful evening of panel discussions, networking, & exploring the future of fintech! This event will be one of the most curated gatherings of the year for fintech founders, Sr. BFSI leaders, and investors.

Event details in comments if you want to RSVP (invite only)

#FintechYatra #AIforFinance",48,1,0,8mo,Post,Nitin K Shaji,https://www.linkedin.com/in/nitin-shaji,https://www.linkedin.com/in/nitin-shaji/,2025-02-18T15:26:00.000Z,,2025-01-22T00:00:00.000Z,,,,2025-02-18
https://www.linkedin.com/feed/update/urn:li:activity:7282395572383227904,https://media.licdn.com/dms/image/v2/D5622AQFuec4oRac5Pg/feedshare-shrink_800/B56ZRBELozG8Ag-/0/1736258403719?e=1763596800&v=beta&t=qKxMCTJW9A9jcPJlqq0TQQk36xWi_9hbBK7WN4RbbHo,Image,"The Fintech Yatra is back with its 7th Edition

We are delighted to be part of this journey as #Bangalore Fintech Mixer Partner! 🥂

Whether you’re seeking market insights, building connections with leading bankers and lenders, or scouting for the perfect VC partner, Bangalore Fintech Mixer is where you should be.

Join us as we discuss what the year ahead looks like for both Fintech & #AI 

RSVP here: https://shorturl.at/zc7Lo",30,0,0,9mo,Post,Nitin K Shaji,https://www.linkedin.com/in/nitin-shaji,https://www.linkedin.com/in/nitin-shaji/,2025-01-19T15:26:00.000Z,,2025-01-07T00:00:00.000Z,,,,2025-01-19
https://www.linkedin.com/feed/update/urn:li:activity:7280895753026187264,https://media.licdn.com/dms/image/v2/D5622AQFXFWkiBY80gA/feedshare-shrink_2048_1536/B56ZQrwGvOH0Ao-/0/1735900819048?e=1763596800&v=beta&t=0Msr2uY46BpydiPs3peZXFqkQQqivNZTxk1xIrwfvxE,Image,"Starting #2025 with some style - We're proud to partner with The Fintech Meetup to co-power the first fintech-focused #Mixer of the year in Bangalore, Koramangala. 

This is part of their flagship road journey, The Fintech Yatra, which has over the years uncovered incredible insights from the ground.

And this year, the landscape is ever-changing with the advent of AI and it's application in the BFSI industry.  Can't wait for the insights that's coming out of this edition of the Yatra!

If you'd love to join the Mixer, link is in the comments.

Please Note: This is an invite-only gathering for Fintech Founders, Investors & BFSI Professionals.

Ashik Rahman Vishnu Satis Abhishant Pant Pankaj Singh Husain Rangoonwala Sagrika Shah Shubhanga Prasad",45,1,1,9mo,Post,Nitin K Shaji,https://www.linkedin.com/in/nitin-shaji,https://www.linkedin.com/in/nitin-shaji/,2025-01-19T15:26:00.000Z,,2025-01-03T00:00:00.000Z,,,,2025-01-19
https://www.linkedin.com/feed/update/urn:li:activity:7274477161804136450,https://media.licdn.com/dms/image/v2/D5622AQFd_J0VhEChiw/feedshare-shrink_800/B56ZPOiKo2GwAg-/0/1734336884836?e=1763596800&v=beta&t=S774_Fd20tYj5w_qUL7lgY6O1dG1I0C9HM458s7zXFY,Image,"The future of AI in #finance is just loading... 🔃
This gives a great perspective on how FIs are looking at adopting AI across the board!

Thanks Saison Capital for creating this map!

Rootflo Visa Kannan Uday Paul Kumar Ashik Rahman Vishnu Satis",21,1,0,9mo,Post,Nitin K Shaji,https://www.linkedin.com/in/nitin-shaji,https://www.linkedin.com/in/nitin-shaji/,2025-01-19T15:26:00.000Z,,2024-12-16T00:00:00.000Z,,https://www.linkedin.com/feed/update/urn:li:activity:7274336141066039296/,,2025-01-19
https://www.linkedin.com/feed/update/urn:li:activity:7269606171861221377,https://media.licdn.com/dms/image/v2/D5622AQHHx6JeOPIufQ/feedshare-shrink_800/feedshare-shrink_800/0/1733124203909?e=1763596800&v=beta&t=wwFCMqt47bP6GfWDDkfnMX4Jo8PNuuuNnSDLnzFOkPQ,Image,"Exciting to be part of the Credit Saison India's Astra program for AI startups!
This is a great opportunity for us to showcase the future of modern finance back-offices with Rootflo.

More on this soon!",16,0,0,10mo,Post,Nitin K Shaji,https://www.linkedin.com/in/nitin-shaji,https://www.linkedin.com/in/nitin-shaji/,2024-12-20T15:26:00.000Z,,2024-12-03T00:00:00.000Z,,https://www.linkedin.com/feed/update/urn:li:activity:7269249789492420608/,,2024-12-20
https://www.linkedin.com/feed/update/urn:li:activity:7269066968635203584,,Text,"Hola folks!

We're #hiring a curious data analyst who's looking to work directly with the core team.
You get to work on developing our cutting-edge AI product as well as be a part of our zero-to-one journey. 

Looking for folks who have a good grip on data crunching, statistics & an eye to uncover insights!

If you know anyone who'd fit the role, do recommend as well!

#dataAnalyst #dataScientist #startupJobs",40,6,1,10mo,Post,Nitin K Shaji,https://www.linkedin.com/in/nitin-shaji,https://www.linkedin.com/in/nitin-shaji/,2024-12-20T15:26:00.000Z,,2024-12-02T00:00:00.000Z,,,https://www.linkedin.com/jobs/view/4087319298/,2024-12-20
https://www.linkedin.com/feed/update/urn:li:activity:7266392265126748160,,Text,"We’re #hiring!
Let me know if you know anyone who’d fit the role 🤝",33,1,1,10mo,Post,Nitin K Shaji,https://www.linkedin.com/in/nitin-shaji,https://www.linkedin.com/in/nitin-shaji/,2024-12-20T15:26:00.000Z,,2024-11-24T00:00:00.000Z,,,https://www.linkedin.com/jobs/view/4081559229/,2024-12-20
